No.     Time           Source                Protocol Destination           Length Info
      1 0.000000000    127.0.0.1             TCP      127.0.0.1             82     44914 → 3310 [PSH, ACK] Seq=1 Ack=1 Win=342 Len=16 TSval=3122268524 TSecr=3122264520

Frame 1: 82 bytes on wire (656 bits), 82 bytes captured (656 bits) on interface 0
Ethernet II, Src: 00:00:00_00:00:00 (00:00:00:00:00:00), Dst: 00:00:00_00:00:00 (00:00:00:00:00:00)
Internet Protocol Version 4, Src: 127.0.0.1, Dst: 127.0.0.1
Transmission Control Protocol, Src Port: 44914, Dst Port: 3310, Seq: 1, Ack: 1, Len: 16
Data (16 bytes)

0000  44 61 74 61 20 66 72 6f 6d 20 63 6c 69 65 6e 74   Data from client

No.     Time           Source                Protocol Destination           Length Info
      2 0.000152390    127.0.0.1             TCP      127.0.0.1             82     3310 → 44914 [PSH, ACK] Seq=1 Ack=17 Win=342 Len=16 TSval=3122268524 TSecr=3122268524

Frame 2: 82 bytes on wire (656 bits), 82 bytes captured (656 bits) on interface 0
Ethernet II, Src: 00:00:00_00:00:00 (00:00:00:00:00:00), Dst: 00:00:00_00:00:00 (00:00:00:00:00:00)
Internet Protocol Version 4, Src: 127.0.0.1, Dst: 127.0.0.1
Transmission Control Protocol, Src Port: 3310, Dst Port: 44914, Seq: 1, Ack: 17, Len: 16
Data (16 bytes)

0000  44 61 74 61 20 66 72 6f 6d 20 73 65 72 76 65 72   Data from server

No.     Time           Source                Protocol Destination           Length Info
      3 0.000172085    127.0.0.1             TCP      127.0.0.1             66     44914 → 3310 [ACK] Seq=17 Ack=17 Win=342 Len=0 TSval=3122268524 TSecr=3122268524

Frame 3: 66 bytes on wire (528 bits), 66 bytes captured (528 bits) on interface 0
Ethernet II, Src: 00:00:00_00:00:00 (00:00:00:00:00:00), Dst: 00:00:00_00:00:00 (00:00:00:00:00:00)
Internet Protocol Version 4, Src: 127.0.0.1, Dst: 127.0.0.1
Transmission Control Protocol, Src Port: 44914, Dst Port: 3310, Seq: 17, Ack: 17, Len: 0

No.     Time           Source                Protocol Destination           Length Info
      4 4.004228831    127.0.0.1             TCP      127.0.0.1             82     44914 → 3310 [PSH, ACK] Seq=17 Ack=17 Win=342 Len=16 TSval=3122272528 TSecr=3122268524

Frame 4: 82 bytes on wire (656 bits), 82 bytes captured (656 bits) on interface 0
Ethernet II, Src: 00:00:00_00:00:00 (00:00:00:00:00:00), Dst: 00:00:00_00:00:00 (00:00:00:00:00:00)
Internet Protocol Version 4, Src: 127.0.0.1, Dst: 127.0.0.1
Transmission Control Protocol, Src Port: 44914, Dst Port: 3310, Seq: 17, Ack: 17, Len: 16
Data (16 bytes)

0000  44 61 74 61 20 66 72 6f 6d 20 63 6c 69 65 6e 74   Data from client

No.     Time           Source                Protocol Destination           Length Info
      5 4.004401475    127.0.0.1             TCP      127.0.0.1             82     3310 → 44914 [PSH, ACK] Seq=17 Ack=33 Win=342 Len=16 TSval=3122272528 TSecr=3122272528

Frame 5: 82 bytes on wire (656 bits), 82 bytes captured (656 bits) on interface 0
Ethernet II, Src: 00:00:00_00:00:00 (00:00:00:00:00:00), Dst: 00:00:00_00:00:00 (00:00:00:00:00:00)
Internet Protocol Version 4, Src: 127.0.0.1, Dst: 127.0.0.1
Transmission Control Protocol, Src Port: 3310, Dst Port: 44914, Seq: 17, Ack: 33, Len: 16
Data (16 bytes)

0000  44 61 74 61 20 66 72 6f 6d 20 73 65 72 76 65 72   Data from server

No.     Time           Source                Protocol Destination           Length Info
      6 4.004423893    127.0.0.1             TCP      127.0.0.1             66     44914 → 3310 [ACK] Seq=33 Ack=33 Win=342 Len=0 TSval=3122272528 TSecr=3122272528

Frame 6: 66 bytes on wire (528 bits), 66 bytes captured (528 bits) on interface 0
Ethernet II, Src: 00:00:00_00:00:00 (00:00:00:00:00:00), Dst: 00:00:00_00:00:00 (00:00:00:00:00:00)
Internet Protocol Version 4, Src: 127.0.0.1, Dst: 127.0.0.1
Transmission Control Protocol, Src Port: 44914, Dst Port: 3310, Seq: 33, Ack: 33, Len: 0

No.     Time           Source                Protocol Destination           Length Info
      7 8.008104203    127.0.0.1             TCP      127.0.0.1             82     44914 → 3310 [PSH, ACK] Seq=33 Ack=33 Win=342 Len=16 TSval=3122276532 TSecr=3122272528

Frame 7: 82 bytes on wire (656 bits), 82 bytes captured (656 bits) on interface 0
Ethernet II, Src: 00:00:00_00:00:00 (00:00:00:00:00:00), Dst: 00:00:00_00:00:00 (00:00:00:00:00:00)
Internet Protocol Version 4, Src: 127.0.0.1, Dst: 127.0.0.1
Transmission Control Protocol, Src Port: 44914, Dst Port: 3310, Seq: 33, Ack: 33, Len: 16
Data (16 bytes)

0000  44 61 74 61 20 66 72 6f 6d 20 63 6c 69 65 6e 74   Data from client

No.     Time           Source                Protocol Destination           Length Info
      8 8.008259526    127.0.0.1             TCP      127.0.0.1             82     3310 → 44914 [PSH, ACK] Seq=33 Ack=49 Win=342 Len=16 TSval=3122276532 TSecr=3122276532

Frame 8: 82 bytes on wire (656 bits), 82 bytes captured (656 bits) on interface 0
Ethernet II, Src: 00:00:00_00:00:00 (00:00:00:00:00:00), Dst: 00:00:00_00:00:00 (00:00:00:00:00:00)
Internet Protocol Version 4, Src: 127.0.0.1, Dst: 127.0.0.1
Transmission Control Protocol, Src Port: 3310, Dst Port: 44914, Seq: 33, Ack: 49, Len: 16
Data (16 bytes)

0000  44 61 74 61 20 66 72 6f 6d 20 73 65 72 76 65 72   Data from server

No.     Time           Source                Protocol Destination           Length Info
      9 8.008280059    127.0.0.1             TCP      127.0.0.1             66     44914 → 3310 [ACK] Seq=49 Ack=49 Win=342 Len=0 TSval=3122276532 TSecr=3122276532

Frame 9: 66 bytes on wire (528 bits), 66 bytes captured (528 bits) on interface 0
Ethernet II, Src: 00:00:00_00:00:00 (00:00:00:00:00:00), Dst: 00:00:00_00:00:00 (00:00:00:00:00:00)
Internet Protocol Version 4, Src: 127.0.0.1, Dst: 127.0.0.1
Transmission Control Protocol, Src Port: 44914, Dst Port: 3310, Seq: 49, Ack: 49, Len: 0

No.     Time           Source                Protocol Destination           Length Info
     10 12.012184692   127.0.0.1             TCP      127.0.0.1             82     44914 → 3310 [PSH, ACK] Seq=49 Ack=49 Win=342 Len=16 TSval=3122280536 TSecr=3122276532

Frame 10: 82 bytes on wire (656 bits), 82 bytes captured (656 bits) on interface 0
Ethernet II, Src: 00:00:00_00:00:00 (00:00:00:00:00:00), Dst: 00:00:00_00:00:00 (00:00:00:00:00:00)
Internet Protocol Version 4, Src: 127.0.0.1, Dst: 127.0.0.1
Transmission Control Protocol, Src Port: 44914, Dst Port: 3310, Seq: 49, Ack: 49, Len: 16
Data (16 bytes)

0000  44 61 74 61 20 66 72 6f 6d 20 63 6c 69 65 6e 74   Data from client

No.     Time           Source                Protocol Destination           Length Info
     11 12.012324231   127.0.0.1             TCP      127.0.0.1             82     3310 → 44914 [PSH, ACK] Seq=49 Ack=65 Win=342 Len=16 TSval=3122280536 TSecr=3122280536

Frame 11: 82 bytes on wire (656 bits), 82 bytes captured (656 bits) on interface 0
Ethernet II, Src: 00:00:00_00:00:00 (00:00:00:00:00:00), Dst: 00:00:00_00:00:00 (00:00:00:00:00:00)
Internet Protocol Version 4, Src: 127.0.0.1, Dst: 127.0.0.1
Transmission Control Protocol, Src Port: 3310, Dst Port: 44914, Seq: 49, Ack: 65, Len: 16
Data (16 bytes)

0000  44 61 74 61 20 66 72 6f 6d 20 73 65 72 76 65 72   Data from server

No.     Time           Source                Protocol Destination           Length Info
     12 12.012345742   127.0.0.1             TCP      127.0.0.1             66     44914 → 3310 [ACK] Seq=65 Ack=65 Win=342 Len=0 TSval=3122280536 TSecr=3122280536

Frame 12: 66 bytes on wire (528 bits), 66 bytes captured (528 bits) on interface 0
Ethernet II, Src: 00:00:00_00:00:00 (00:00:00:00:00:00), Dst: 00:00:00_00:00:00 (00:00:00:00:00:00)
Internet Protocol Version 4, Src: 127.0.0.1, Dst: 127.0.0.1
Transmission Control Protocol, Src Port: 44914, Dst Port: 3310, Seq: 65, Ack: 65, Len: 0

No.     Time           Source                Protocol Destination           Length Info
     13 16.016142681   127.0.0.1             TCP      127.0.0.1             82     44914 → 3310 [PSH, ACK] Seq=65 Ack=65 Win=342 Len=16 TSval=3122284540 TSecr=3122280536

Frame 13: 82 bytes on wire (656 bits), 82 bytes captured (656 bits) on interface 0
Ethernet II, Src: 00:00:00_00:00:00 (00:00:00:00:00:00), Dst: 00:00:00_00:00:00 (00:00:00:00:00:00)
Internet Protocol Version 4, Src: 127.0.0.1, Dst: 127.0.0.1
Transmission Control Protocol, Src Port: 44914, Dst Port: 3310, Seq: 65, Ack: 65, Len: 16
Data (16 bytes)

0000  44 61 74 61 20 66 72 6f 6d 20 63 6c 69 65 6e 74   Data from client

No.     Time           Source                Protocol Destination           Length Info
     14 16.016329641   127.0.0.1             TCP      127.0.0.1             82     3310 → 44914 [PSH, ACK] Seq=65 Ack=81 Win=342 Len=16 TSval=3122284540 TSecr=3122284540

Frame 14: 82 bytes on wire (656 bits), 82 bytes captured (656 bits) on interface 0
Ethernet II, Src: 00:00:00_00:00:00 (00:00:00:00:00:00), Dst: 00:00:00_00:00:00 (00:00:00:00:00:00)
Internet Protocol Version 4, Src: 127.0.0.1, Dst: 127.0.0.1
Transmission Control Protocol, Src Port: 3310, Dst Port: 44914, Seq: 65, Ack: 81, Len: 16
Data (16 bytes)

0000  44 61 74 61 20 66 72 6f 6d 20 73 65 72 76 65 72   Data from server

No.     Time           Source                Protocol Destination           Length Info
     15 16.016351850   127.0.0.1             TCP      127.0.0.1             66     44914 → 3310 [ACK] Seq=81 Ack=81 Win=342 Len=0 TSval=3122284540 TSecr=3122284540

Frame 15: 66 bytes on wire (528 bits), 66 bytes captured (528 bits) on interface 0
Ethernet II, Src: 00:00:00_00:00:00 (00:00:00:00:00:00), Dst: 00:00:00_00:00:00 (00:00:00:00:00:00)
Internet Protocol Version 4, Src: 127.0.0.1, Dst: 127.0.0.1
Transmission Control Protocol, Src Port: 44914, Dst Port: 3310, Seq: 81, Ack: 81, Len: 0
